{
  "schemaVersion": 1,
  "listVersion": "2026-08-06",
  "standard": "ISO 3166-1 alpha-2",
  "source": {
    "authority": "International Organization for Standardization",
    "url": "https://www.iso.org/obp/ui/#search",
    "reviewedAt": "2026-08-06"
  },
  "jurisdictions": [
    {"code": "AD", "kind": "country_or_area"},
    {"code": "AE", "kind": "country_or_area"},
    {"code": "AF", "kind": "country_or_area"},
    {"code": "AG", "kind": "country_or_area"},
    {"code": "AI", "kind": "country_or_area"},
    {"code": "AL", "kind": "country_or_area"},
    {"code": "AM", "kind": "country_or_area"},
    {"code": "AO", "kind": "country_or_area"},
    {"code": "AQ", "kind": "country_or_area"},
    {"code": "AR", "kind": "country_or_area"},
    {"code": "AS", "kind": "country_or_area"},
    {"code": "AT", "kind": "country_or_area"},
    {"code": "AU", "kind": "country_or_area"},
    {"code": "AW", "kind": "country_or_area"},
    {"code": "AX", "kind": "country_or_area"},
    {"code": "AZ", "kind": "country_or_area"},
    {"code": "BA", "kind": "country_or_area"},
    {"code": "BB", "kind": "country_or_area"},
    {"code": "BD", "kind": "country_or_area"},
    {"code": "BE", "kind": "country_or_area"},
    {"code": "BF", "kind": "country_or_area"},
    {"code": "BG", "kind": "country_or_area"},
    {"code": "BH", "kind": "country_or_area"},
    {"code": "BI", "kind": "country_or_area"},
    {"code": "BJ", "kind": "country_or_area"},
    {"code": "BL", "kind": "country_or_area"},
    {"code": "BM", "kind": "country_or_area"},
    {"code": "BN", "kind": "country_or_area"},
    {"code": "BO", "kind": "country_or_area"},
    {"code": "BQ", "kind": "country_or_area"},
    {"code": "BR", "kind": "country_or_area"},
    {"code": "BS", "kind": "country_or_area"},
    {"code": "BT", "kind": "country_or_area"},
    {"code": "BV", "kind": "country_or_area"},
    {"code": "BW", "kind": "country_or_area"},
    {"code": "BY", "kind": "country_or_area"},
    {"code": "BZ", "kind": "country_or_area"},
    {"code": "CA", "kind": "country_or_area"},
    {"code": "CC", "kind": "country_or_area"},
    {"code": "CD", "kind": "country_or_area"},
    {"code": "CF", "kind": "country_or_area"},
    {"code": "CG", "kind": "country_or_area"},
    {"code": "CH", "kind": "country_or_area"},
    {"code": "CI", "kind": "country_or_area"},
    {"code": "CK", "kind": "country_or_area"},
    {"code": "CL", "kind": "country_or_area"},
    {"code": "CM", "kind": "country_or_area"},
    {"code": "CN", "kind": "country_or_area"},
    {"code": "CO", "kind": "country_or_area"},
    {"code": "CR", "kind": "country_or_area"},
    {"code": "CU", "kind": "country_or_area"},
    {"code": "CV", "kind": "country_or_area"},
    {"code": "CW", "kind": "country_or_area"},
    {"code": "CX", "kind": "country_or_area"},
    {"code": "CY", "kind": "country_or_area"},
    {"code": "CZ", "kind": "country_or_area"},
    {"code": "DE", "kind": "country_or_area"},
    {"code": "DJ", "kind": "country_or_area"},
    {"code": "DK", "kind": "country_or_area"},
    {"code": "DM", "kind": "country_or_area"},
    {"code": "DO", "kind": "country_or_area"},
    {"code": "DZ", "kind": "country_or_area"},
    {"code": "EC", "kind": "country_or_area"},
    {"code": "EE", "kind": "country_or_area"},
    {"code": "EG", "kind": "country_or_area"},
    {"code": "EH", "kind": "country_or_area"},
    {"code": "ER", "kind": "country_or_area"},
    {"code": "ES", "kind": "country_or_area"},
    {"code": "ET", "kind": "country_or_area"},
    {"code": "FI", "kind": "country_or_area"},
    {"code": "FJ", "kind": "country_or_area"},
    {"code": "FK", "kind": "country_or_area"},
    {"code": "FM", "kind": "country_or_area"},
    {"code": "FO", "kind": "country_or_area"},
    {"code": "FR", "kind": "country_or_area"},
    {"code": "GA", "kind": "country_or_area"},
    {"code": "GB", "kind": "country_or_area"},
    {"code": "GD", "kind": "country_or_area"},
    {"code": "GE", "kind": "country_or_area"},
    {"code": "GF", "kind": "country_or_area"},
    {"code": "GG", "kind": "country_or_area"},
    {"code": "GH", "kind": "country_or_area"},
    {"code": "GI", "kind": "country_or_area"},
    {"code": "GL", "kind": "country_or_area"},
    {"code": "GM", "kind": "country_or_area"},
    {"code": "GN", "kind": "country_or_area"},
    {"code": "GP", "kind": "country_or_area"},
    {"code": "GQ", "kind": "country_or_area"},
    {"code": "GR", "kind": "country_or_area"},
    {"code": "GS", "kind": "country_or_area"},
    {"code": "GT", "kind": "country_or_area"},
    {"code": "GU", "kind": "country_or_area"},
    {"code": "GW", "kind": "country_or_area"},
    {"code": "GY", "kind": "country_or_area"},
    {"code": "HK", "kind": "country_or_area"},
    {"code": "HM", "kind": "country_or_area"},
    {"code": "HN", "kind": "country_or_area"},
    {"code": "HR", "kind": "country_or_area"},
    {"code": "HT", "kind": "country_or_area"},
    {"code": "HU", "kind": "country_or_area"},
    {"code": "ID", "kind": "country_or_area"},
    {"code": "IE", "kind": "country_or_area"},
    {"code": "IL", "kind": "country_or_area"},
    {"code": "IM", "kind": "country_or_area"},
    {"code": "IN", "kind": "country_or_area"},
    {"code": "IO", "kind": "country_or_area"},
    {"code": "IQ", "kind": "country_or_area"},
    {"code": "IR", "kind": "country_or_area"},
    {"code": "IS", "kind": "country_or_area"},
    {"code": "IT", "kind": "country_or_area"},
    {"code": "JE", "kind": "country_or_area"},
    {"code": "JM", "kind": "country_or_area"},
    {"code": "JO", "kind": "country_or_area"},
    {"code": "JP", "kind": "country_or_area"},
    {"code": "KE", "kind": "country_or_area"},
    {"code": "KG", "kind": "country_or_area"},
    {"code": "KH", "kind": "country_or_area"},
    {"code": "KI", "kind": "country_or_area"},
    {"code": "KM", "kind": "country_or_area"},
    {"code": "KN", "kind": "country_or_area"},
    {"code": "KP", "kind": "country_or_area"},
    {"code": "KR", "kind": "country_or_area"},
    {"code": "KW", "kind": "country_or_area"},
    {"code": "KY", "kind": "country_or_area"},
    {"code": "KZ", "kind": "country_or_area"},
    {"code": "LA", "kind": "country_or_area"},
    {"code": "LB", "kind": "country_or_area"},
    {"code": "LC", "kind": "country_or_area"},
    {"code": "LI", "kind": "country_or_area"},
    {"code": "LK", "kind": "country_or_area"},
    {"code": "LR", "kind": "country_or_area"},
    {"code": "LS", "kind": "country_or_area"},
    {"code": "LT", "kind": "country_or_area"},
    {"code": "LU", "kind": "country_or_area"},
    {"code": "LV", "kind": "country_or_area"},
    {"code": "LY", "kind": "country_or_area"},
    {"code": "MA", "kind": "country_or_area"},
    {"code": "MC", "kind": "country_or_area"},
    {"code": "MD", "kind": "country_or_area"},
    {"code": "ME", "kind": "country_or_area"},
    {"code": "MF", "kind": "country_or_area"},
    {"code": "MG", "kind": "country_or_area"},
    {"code": "MH", "kind": "country_or_area"},
    {"code": "MK", "kind": "country_or_area"},
    {"code": "ML", "kind": "country_or_area"},
    {"code": "MM", "kind": "country_or_area"},
    {"code": "MN", "kind": "country_or_area"},
    {"code": "MO", "kind": "country_or_area"},
    {"code": "MP", "kind": "country_or_area"},
    {"code": "MQ", "kind": "country_or_area"},
    {"code": "MR", "kind": "country_or_area"},
    {"code": "MS", "kind": "country_or_area"},
    {"code": "MT", "kind": "country_or_area"},
    {"code": "MU", "kind": "country_or_area"},
    {"code": "MV", "kind": "country_or_area"},
    {"code": "MW", "kind": "country_or_area"},
    {"code": "MX", "kind": "country_or_area"},
    {"code": "MY", "kind": "country_or_area"},
    {"code": "MZ", "kind": "country_or_area"},
    {"code": "NA", "kind": "country_or_area"},
    {"code": "NC", "kind": "country_or_area"},
    {"code": "NE", "kind": "country_or_area"},
    {"code": "NF", "kind": "country_or_area"},
    {"code": "NG", "kind": "country_or_area"},
    {"code": "NI", "kind": "country_or_area"},
    {"code": "NL", "kind": "country_or_area"},
    {"code": "NO", "kind": "country_or_area"},
    {"code": "NP", "kind": "country_or_area"},
    {"code": "NR", "kind": "country_or_area"},
    {"code": "NU", "kind": "country_or_area"},
    {"code": "NZ", "kind": "country_or_area"},
    {"code": "OM", "kind": "country_or_area"},
    {"code": "PA", "kind": "country_or_area"},
    {"code": "PE", "kind": "country_or_area"},
    {"code": "PF", "kind": "country_or_area"},
    {"code": "PG", "kind": "country_or_area"},
    {"code": "PH", "kind": "country_or_area"},
    {"code": "PK", "kind": "country_or_area"},
    {"code": "PL", "kind": "country_or_area"},
    {"code": "PM", "kind": "country_or_area"},
    {"code": "PN", "kind": "country_or_area"},
    {"code": "PR", "kind": "country_or_area"},
    {"code": "PS", "kind": "country_or_area"},
    {"code": "PT", "kind": "country_or_area"},
    {"code": "PW", "kind": "country_or_area"},
    {"code": "PY", "kind": "country_or_area"},
    {"code": "QA", "kind": "country_or_area"},
    {"code": "RE", "kind": "country_or_area"},
    {"code": "RO", "kind": "country_or_area"},
    {"code": "RS", "kind": "country_or_area"},
    {"code": "RU", "kind": "country_or_area"},
    {"code": "RW", "kind": "country_or_area"},
    {"code": "SA", "kind": "country_or_area"},
    {"code": "SB", "kind": "country_or_area"},
    {"code": "SC", "kind": "country_or_area"},
    {"code": "SD", "kind": "country_or_area"},
    {"code": "SE", "kind": "country_or_area"},
    {"code": "SG", "kind": "country_or_area"},
    {"code": "SH", "kind": "country_or_area"},
    {"code": "SI", "kind": "country_or_area"},
    {"code": "SJ", "kind": "country_or_area"},
    {"code": "SK", "kind": "country_or_area"},
    {"code": "SL", "kind": "country_or_area"},
    {"code": "SM", "kind": "country_or_area"},
    {"code": "SN", "kind": "country_or_area"},
    {"code": "SO", "kind": "country_or_area"},